{"embedding":{"dim":384,"model":"intfloat/multilingual-e5-small","normalized":true},"items":[{"approved_at":"2026-09-05T00:00:00Z","approved_by":"contract-fixture","axis":"omission","code":"LOAN-INT-001","embedding_id":"e5:LOAN-INT-001","evidence":{"bbox":[43.3,336.8,551.7,346.7],"doc_id":"06_상품설명서_가계대출","page":4,"span":"◉ 대출금리의 종류는 크게 고정금리 방식, 변동금리 방식, 혼합금리 방식으로 구분되며, 고객님이 가입하신 상품은 ➊-④ 금리선택"},"l1_patterns":[{"element":"금리 방식","kind":"regex","value":"고정금리|변동금리|혼합금리|금리\\s*(방식|종류|유형)"},{"element":"변동 가능성","kind":"regex","value":"변동\\s*가능성|(금리|이자)[가이은는도]?\\s*(오를|올라갈|바뀔|변할|달라질|변동될)|기준\\s*금리[가이]?\\s*(바뀌|변동|오르|올라)"}],"legal_basis":[{"article":"제19조제1항","law":"금융소비자보호법"}],"name":"금리 구성과 변동금리 위험","plain_language":["변동금리는 기준이 바뀌면 내 금리도 바뀔 수 있습니다."],"requirement_elements":["금리 방식","변동 가능성"],"type":"required"},{"approved_at":"2026-09-05T00:00:00Z","approved_by":"contract-fixture","axis":"omission","code":"LOAN-RDR-001","embedding_id":"e5:LOAN-RDR-001","evidence":{"bbox":[54.6,574.9,555.2,600.4],"doc_id":"06_상품설명서_가계대출","page":3,"span":"금리인하요구권이란 금융소비자가 본인의 신용상태가 개선 되었다고 판단되는 경우(취업 · 승진 · 재산증가 · 개인신용평점 상승 등) 은행에 자신이 적용받는 금리인하를 요구 할 수 있는 권리(은행법 제30조의2)를 말합니다."},"l1_patterns":[{"element":"신용상태 개선 시 인하 요구","kind":"regex","value":"금리\\s*인하\\s*요구|(신용|소득)(상태|등급|점수)?[이가]?\\s*(좋아|개선|오르|올라)"},{"element":"대상 제외 가능성","kind":"regex","value":"(대상|해당)[이에]?\\s*(아닐|아니|아닌|안\\s*(될|되)|제외)|제외"}],"legal_basis":[{"article":"제30조의2","law":"은행법"}],"name":"금리인하요구권","plain_language":["취업·승진·재산 증가처럼 신용상태가 좋아지면 금리를 내려 달라고 요구할 수 있습니다.","정책자금대출·집단대출처럼 신용상태가 금리에 영향을 주지 않는 상품은 대상이 아닙니다."],"requirement_elements":["신용상태 개선 시 인하 요구","대상 제외 가능성"],"type":"required"},{"approved_at":"2026-09-05T00:00:00Z","approved_by":"contract-fixture","axis":"omission","code":"LOAN-ARR-001","embedding_id":"e5:LOAN-ARR-001","evidence":{"bbox":[43.3,468.8,303.1,479.2],"doc_id":"06_상품설명서_가계대출","page":7,"span":"◉ 연체이자율은 [대출이자율 + 연체가산이자율]로 적용합니다."},"l1_patterns":[{"element":"대출이자율","kind":"regex","value":"대출\\s*이자율|약정\\s*(금리|이자율)|(원래|기존|정상)\\s*(금리|이자율)"},{"element":"연체가산이자율","kind":"regex","value":"연체\\s*가산|가산\\s*(금리|이자율)"}],"legal_basis":[{"article":"제19조제1항","law":"금융소비자보호법"}],"name":"연체이자율","numeric_facts":[{"evidence":{"bbox":[74.4,450.1,169.4,459.5],"doc_id":"06_상품설명서_가계대출","page":7,"span":"연체가산이자율 : 연 3%"},"label":"연체가산이자율","tolerance":0,"unit":"%","value":"3"}],"plain_language":["연체하면 원래 금리에 연 3% 의 연체 가산금리가 더해집니다.","갚는 날을 넘기면 그날부터 이자가 더 붙습니다."],"requirement_elements":["대출이자율","연체가산이자율"],"type":"required"},{"approved_at":"2026-09-05T00:00:00Z","approved_by":"contract-fixture","axis":"omission","code":"LOAN-PRE-001","embedding_id":"e5:LOAN-PRE-001","evidence":{"bbox":[57.7,191.7,552.6,201.3],"doc_id":"06_상품설명서_가계대출","page":8,"span":"☞ 대출계약의 해지 시 중도상환해약금이 부과될 수 있습니다. 중도상환해약금은 대출계약이 성립한 날부터 3년 이내의 기간에만"},"l1_patterns":[{"element":"부과 가능성","kind":"regex","value":"중도\\s*상환\\s*(수수료|해약금)|(일찍|미리|먼저|조기)\\s*(갚|상환)"},{"element":"적용 기간","kind":"regex","value":"3\\s*년|삼\\s*년|(년|개월)\\s*(이내|안|지나|경과|후)|적용\\s*기간"}],"legal_basis":[{"article":"제20조","law":"금융소비자보호법"}],"name":"중도상환수수료","numeric_facts":[{"condition":"대출계약이 성립한 날부터","evidence":{"bbox":[57.7,191.7,552.6,201.3],"doc_id":"06_상품설명서_가계대출","page":8,"span":"☞ 대출계약의 해지 시 중도상환해약금이 부과될 수 있습니다. 중도상환해약금은 대출계약이 성립한 날부터 3년 이내의 기간에만"},"label":"중도상환해약금","tolerance":0,"unit":"년","value":"3"}],"plain_language":["대출을 일찍 갚으면 일정 기간 수수료가 붙을 수 있습니다."],"requirement_elements":["부과 가능성","적용 기간"],"type":"required"},{"approved_at":"2026-09-05T00:00:00Z","approved_by":"contract-fixture","axis":"omission","code":"LOAN-DSR-001","embedding_id":"e5:LOAN-DSR-001","evidence":{"bbox":[43.3,127.5,552.3,137.5],"doc_id":"06_상품설명서_가계대출","page":8,"span":"◉ 은행은 고객님의 정확한 상환능력을 추론하기 위하여 DSR(총부채원리금상환비율)을 산출하여 심사에 활용할 수 있으며, 연소"},"l1_patterns":[{"element":"DSR 산출","kind":"regex","value":"DSR|디에스알|총\\s*부채\\s*원리금\\s*상환\\s*비율"},{"element":"심사 활용","kind":"regex","value":"심사|상환\\s*능력|한도\\s*(산정|계산|결정)"}],"legal_basis":[{"article":"제29조의2","law":"은행업감독규정"}],"name":"DSR","plain_language":["소득에 비해 모든 대출의 원리금을 얼마나 갚아야 하는지 계산해 심사합니다."],"requirement_elements":["DSR 산출","심사 활용"],"type":"required"},{"approved_at":"2026-09-05T00:00:00Z","approved_by":"contract-fixture","axis":"omission","code":"LOAN-WDR-001","embedding_id":"e5:LOAN-WDR-001","evidence":{"bbox":[43.3,710.4,552.6,720.3],"doc_id":"06_상품설명서_가계대출","page":3,"span":"◉ 청약철회를 위해서는 영업점, 인터넷뱅킹, 스마트뱅킹 등으로 은행에 청약 철회의 의사표시를 해야 하며, 이미 수령한 대출금과"},"l1_patterns":[{"element":"철회 의사표시","kind":"regex","value":"청약\\s*철회|철회"},{"element":"대출금 반환","kind":"regex","value":"반환|돌려\\s*(주|드리)|(대출금|원금)[을과]?\\s*(갚|상환)"}],"legal_basis":[{"article":"제46조","law":"금융소비자보호법"}],"name":"청약철회권","numeric_facts":[{"condition":"나중에 발생한 날로부터","evidence":{"bbox":[54.7,740.9,555.6,765.2],"doc_id":"06_상품설명서_가계대출","page":3,"span":"나중에 발생한 날로부터 14일 내에 계약에 대한 청약을 철회할 수 있습니다"},"label":"청약을 철회","tolerance":0,"unit":"일","value":"14"}],"plain_language":["14일 안에는 의사를 밝히고 받은 돈을 돌려주어 계약을 철회할 수 있습니다.","대출을 받은 뒤 마음이 바뀌면 14일 안에 무를 수 있습니다."],"requirement_elements":["철회 의사표시","대출금 반환"],"type":"required"},{"approved_at":"2026-09-05T00:00:00Z","approved_by":"contract-fixture","axis":"omission","code":"LOAN-CIC-001","embedding_id":"e5:LOAN-CIC-001","evidence":{"bbox":[81.8,417.2,540.6,433.7],"doc_id":"06_상품설명서_가계대출","page":12,"span":"신용정보 ■ 개인식별정보(성명, 주민번호 등), 신용거래정보(대출정보 등), 신용도판단정보(연체정보 등),"},"l1_patterns":[{"element":"조회 정보","kind":"regex","value":"신용\\s*정보|신용\\s*(조회|등급|점수)|(개인\\s*식별|신용\\s*거래|연체)\\s*정보"},{"element":"동의 범위","kind":"regex","value":"(정보|조회|제공|활용)\\s*동의|동의\\s*(범위|내용|항목|가\\s*필요|를\\s*받)|(제공|활용|이용)\\s*(범위|목적)"}],"legal_basis":[{"article":"제32조","law":"신용정보의 이용 및 보호에 관한 법률"}],"name":"신용정보 조회와 동의","plain_language":["심사를 위해 어떤 신용정보를 확인하는지 동의 내용을 살펴봐야 합니다."],"requirement_elements":["조회 정보","동의 범위"],"type":"required"},{"approved_at":"2026-09-05T00:00:00Z","approved_by":"contract-fixture","code":"LOAN-DOC-001","documents_required":["소득증명서류","재직증명서(급여소득자)","사업자등록증(사업소득자)"],"embedding_id":"e5:LOAN-DOC-001","evidence":{"bbox":[77.8,137.8,158.4,143.7],"doc_id":"08_상품공시_BEST신용대출","page":2,"span":"필요서류 소득증명서류"},"l1_patterns":[],"legal_basis":[{"article":"제19조제1항","law":"금융소비자보호법"}],"name":"필요 서류","plain_language":["급여소득자는 소득증명서류와 재직증명서를, 사업소득자는 소득증명서류와 사업자등록증을 준비합니다.","하나은행 BEST 신용대출 상품 공시 기준입니다."],"requirement_elements":["소득증명서류","재직증명서(급여소득자)","사업자등록증(사업소득자)"],"type":"reference"},{"approved_at":"2026-09-05T00:00:00Z","approved_by":"contract-fixture","axis":"commission","code":"LOAN-BAN-001","embedding_id":"e5:LOAN-BAN-001","evidence":{"bbox":[61.3,170.0,554.2,181.6],"doc_id":"01_금융소비자보호법","page":11,"span":"1. 불확실한 사항에 대하여 단정적 판단을 제공하거나 확실하다고 오인하게 할 소지가 있는"},"forbidden_examples":["무조건 승인됩니다","심사는 걱정 안 하셔도 돼요, 통과된 거나 다름없어요","이 금리로 확정이라고 보시면 돼요","한도는 이만큼 확실히 나옵니다","승인은 100% 보장됩니다"],"l1_patterns":[{"element":"심사 결과 단정 금지","kind":"regex","value":"무조건\\s*(승인|통과|나(옵|와)|돼|됩)|(승인|통과)[은는이가]?\\s*(확실|틀림없|보장|걱정\\s*(안|마))|(확정|승인|통과)(이라고|으로|된\\s*거나)\\s*(보시|생각하시|다름없)|100\\s*%\\s*(승인|통과|보장)|(확실히|틀림없이)\\s*(나옵|나와|승인|통과|됩)"}],"legal_basis":[{"article":"제21조제1호","law":"금융소비자보호법"}],"name":"심사 통과 단정 금지","plain_language":["심사 전에는 통과를 확정해 말하면 안 됩니다."],"requirement_elements":["심사 결과 단정 금지"],"type":"forbidden"},{"approved_at":"2026-09-05T00:00:00Z","approved_by":"contract-fixture","axis":"commission","code":"LOAN-RSK-001","embedding_id":"e5:LOAN-RSK-001","evidence":{"bbox":[71.0,532.0,553.5,543.6],"doc_id":"01_금융소비자보호법","page":11,"span":"가. 자기 또는 제3자의 이익을 위하여 금융소비자에게 특정 대출 상환방식을 강요하는 행"},"forbidden_examples":["이 방식으로 갚으셔야 대출이 나갑니다","다른 상환방식은 안 됩니다","이 조건이면 무조건 이렇게 하셔야 해요"],"l1_patterns":[{"element":"상환방식 강요","kind":"regex","value":"강요|이\\s*방식으로.{0,6}갚|다른\\s*상환\\s*방식.{0,4}안|정한\\s*대로\\s*(하|갚|상환)"}],"legal_basis":[{"article":"제20조","law":"금융소비자보호법"}],"name":"상환방식 강요 금지","plain_language":["특정 상환방식을 강요하면 불공정영업행위입니다."],"requirement_elements":["제3자 이익","상환방식 강요"],"type":"forbidden"}],"jargon_terms":["금리인하요구권","중도상환해약금","연체가산이자율","변동금리","고정금리","혼합금리","DSR","총부채원리금상환비율","근저당권","청약철회","신용정보","기한의 이익","담보","보증"],"pack_version":"LOAN-2026.08-v6","product":{"category":"loan","code":"HNB-HOUSEHOLD-CREDIT","name":"하나은행 가계 신용대출"},"published_at":"2026-09-05T00:00:00Z","published_by":"contract-fixture","schema_version":"1","sources":[{"doc_id":"01_금융소비자보호법","page_count":31,"publisher":"법제처","snapshot_date":"2026-08-23","title":"금융소비자 보호에 관한 법률","url":"https://www.law.go.kr/LSW/lsPdfPrint.do?ancYnChk=0&lsiSeq=252409&efYd=20231012&efGubun=Y&joAllCheck=Y&joEfOutPutYn=on&mokChaChk=N&bylChaChk=N"},{"doc_id":"02_설명의무_이행_가이드라인","page_count":20,"publisher":"금융위원회·금융감독원","snapshot_date":"2026-08-23","title":"금융상품 설명의무의 합리적 이행을 위한 가이드라인 (2021.7.14, 금융위·금감원)","url":"https://www.fsc.go.kr/comm/getFile?srvcId=BBSTY1&upperNo=76243&fileTy=ATTACH&fileNo=2"},{"doc_id":"04_은행여신거래기본약관_가계용","page_count":9,"publisher":"은행연합회 (우리은행 게시본)","snapshot_date":"2026-08-23","title":"은행여신거래기본약관(가계용) (우리은행 게시본)","url":"https://spot.wooribank.com/pot/bbs?cmd=download&BOARD_ID=B00179&ARTICLE_ID=3303&ATTACH_ID=28132"},{"doc_id":"06_상품설명서_가계대출","page_count":24,"publisher":"하나은행","snapshot_date":"2026-08-23","title":"하나은행 가계대출 상품설명서 (2025.01 개정)","url":"https://image.kebhana.com/cont/download/documents/manual/0000005060618_20250113_m.pdf"},{"doc_id":"07_제2차_금융분야_보이스피싱_대책","page_count":18,"publisher":"금융위원회","snapshot_date":"2026-08-23","title":"제2차 금융분야 보이스피싱 대책 (금융위)","url":"https://www.fsc.go.kr/comm/getFile?srvcId=BBSTY1&upperNo=79511&fileTy=ATTACH&fileNo=4"},{"doc_id":"08_상품공시_BEST신용대출","page_count":3,"publisher":"하나은행","snapshot_date":"2026-09-05","title":"하나은행 BEST 신용대출 상품 공시 (준법감시인 심의필 제2025-상품공시-1055호, 유효 2025.12.26~2027.11.30)","url":"https://www.kebhana.com/cont/mall/mall08/mall0802/mall080204/1431602_115200.jsp"}]}
